nid,title,hide_title,summary,components
1001,"Demo Basic/Landing Page",0,"Lorem ipsum dolor sit amet, consectetur adipiscing elit, sed do eiusmod tempor incididunt ut labore et dolore magna aliqua. Ut enim ad minim veniam, quis nostrud exercitation ullamco laboris nisi ut aliquip ex ea commodo consequat.",1602|1501|1701|1603|1601|6201|1501|1702|1703|1801|1901|2001|1902|2201|2202|6401|6001|6501
1002,"Demo Basic/Landing Page with Hidden Title",1,"Lorem ipsum dolor sit amet, consectetur adipiscing elit, sed do eiusmod tempor incididunt ut labore et dolore magna aliqua. Ut enim ad minim veniam, quis nostrud exercitation ullamco laboris nisi ut aliquip ex ea commodo consequat.",2702|2801|1602|1501|1701|1603|1601|1501|1702|1703|1801|1901|6202|2001|1902|2201|2202
1003,"Demo Spotlights",0,"Lorem ipsum dolor sit amet, consectetur adipiscing elit, sed do eiusmod tempor incididunt ut labore et dolore magna aliqua. Ut enim ad minim veniam, quis nostrud exercitation ullamco laboris nisi ut aliquip ex ea commodo consequat.",2501|2502|2503|2504
1004,"Demo Headline heros",1,"Lorem ipsum dolor sit amet, consectetur adipiscing elit, sed do eiusmod tempor incididunt ut labore et dolore magna aliqua. Ut enim ad minim veniam, quis nostrud exercitation ullamco laboris nisi ut aliquip ex ea commodo consequat.","2701|2702"
1005,"30 Days Wild",0,"30 Days Wild is The Wildlife Trust's month-long nature campaign. We challenge you to do one wild thing every day throughout June.That's 30 simple, fun and exciting Random Acts of Wildness. This year, over 49,000 people have signed up to take part and connect with nature this month!",6301
